{
  "manifestVersion": 1,
  "id": "tidy.pi",
  "version": "0.1.0-dev",
  "protocol": { "major": 1, "minMinor": 0, "maxMinor": 0 },
  "entrypoint": { "path": "backend.mjs", "args": [] },
  "configSchema": "config.schema.json",
  "runtime": { "name": "pi", "testedVersion": "0.85.0", "transport": "rpc" },
  "requestedAccess": {
    "workspace": "read-write",
    "nativeProfile": true,
    "network": true,
    "gatewayTools": ["fleet.discover", "fleet.send", "artifact.read"]
  }
}
